Free Company Name,Content
Sae-a,"From yarn-production through its fabric mills that draw on in new innovation and technology, to retail operations in Korea, SAE-A has become one of the few apparel manufacturers capable of achieving complete vertical-integration of..."
2networkit,"2Networkit.com inc. focuses mainly on I.T. (Information Technology) Remote access design and implementation, I.T. Consultation and Web hosting. The president Marc Villeneuve has over 25 years experience in the IT industry and has been..."
Generator-power,"Power Generator HireWe have one of the widest ranges in the UK, with generators and ancillary equipment that can handle anything from a planned event to an emergency power shortage. Emergency responseWherever you are in the UK, we..."
Landaumedia,"Landau Media is one of the leading players in the field of media monitoring, press review services, and media analysis in Germany. Thanks to our in-house analysis technology, we can search the media landscape across all media types...."
Boss-inc,"BOSS is made up of a team of educated, experienced professionals who are passionate about assisting human service organizations with the often tedious tasks most people don’t like to do – and perhaps, don’t know how..."
